{"artifacts":[{"archive_path":"models/llama-3.2-3b-instruct-q4-k-m/log-linked.tar","archive_sha256":"sha256:2894353e5640e731cfd1fc00f12b64b6c86f0d17bb1cbdeb4e5f5115703e1e67","archive_size_bytes":4484464640,"bundle_count":60,"index_sha256":"sha256:c1280fd46ba433a4408ffebddce9be83ed8dfcd9f9299468b458659d475b0ab0","mode":"LOG_LINKED","model_id":"llama-3.2-3b-instruct-q4-k-m"},{"archive_path":"models/llama-3.2-3b-instruct-q4-k-m/proxy.tar","archive_sha256":"sha256:c35032aa65ac367e3242c1d9a3d2690bac6d6b39c3471ea0e2e5029ae8111af1","archive_size_bytes":4484208640,"bundle_count":60,"index_sha256":"sha256:a403b1a71eb2db81ead20bff1929043e4f36dc476efb05338955bce3f21144d2","mode":"PROXY","model_id":"llama-3.2-3b-instruct-q4-k-m"},{"archive_path":"models/qwen2.5-7b-instruct-q4-k-m/log-linked.tar","archive_sha256":"sha256:d2c6f7f2b1b0bfbbeebba8d8242a91f1aa59b9f037f8fbc9868718239870195b","archive_size_bytes":2137180160,"bundle_count":60,"index_sha256":"sha256:383bb3cc073f0526ae346518c31165ef112323fe38a3e80c2fadf7cae41661af","mode":"LOG_LINKED","model_id":"qwen2.5-7b-instruct-q4-k-m"},{"archive_path":"models/qwen2.5-7b-instruct-q4-k-m/proxy.tar","archive_sha256":"sha256:7820484a828bbea5c19dec6e935457482cbde28abdcadbd1d4ed9d19cc21a2e1","archive_size_bytes":2136924160,"bundle_count":60,"index_sha256":"sha256:bdac3dda08655ede709ccbd01d9421006bfdddc3933b7748adc15216de1f8613","mode":"PROXY","model_id":"qwen2.5-7b-instruct-q4-k-m"}],"model_licenses":[{"kv_redistribution_decision":"PUBLIC_APPROVED","license_id":"llama-3.2-community","license_path":"licenses/LICENSE.llama-3.2.txt","license_sha256":"sha256:8cc15535a8a34b41888f644b339a1a9eb428af793a4f5e24df58a3e5b1487d74","license_url":"https://huggingface.co/meta-llama/Llama-3.2-3B-Instruct/blob/main/LICENSE.txt","model_id":"llama-3.2-3b-instruct-q4-k-m","redistributes_weights":false,"reviewer":"project-owner","source_revision":"0cb88a4f764b7a12671c53f0838cd831a0843b95"},{"kv_redistribution_decision":"PUBLIC_APPROVED","license_id":"Apache-2.0","license_path":"licenses/LICENSE.qwen2.5-apache-2.0.txt","license_sha256":"sha256:832dd9e00a68dd83b3c3fb9f5588dad7dcf337a0db50f7d9483f310cd292e92e","license_url":"https://huggingface.co/Qwen/Qwen2.5-7B-Instruct-GGUF/blob/main/LICENSE","model_id":"qwen2.5-7b-instruct-q4-k-m","redistributes_weights":false,"reviewer":"project-owner","source_revision":"bb5d59e06d9551d752d08b292a50eb208b07ab1f"}],"release_id":"evaluation1-release-v1","schema_version":"1.0","source_evaluation":"Evaluation1","weights_included":false}
